"cat","type","name","book","page","desc","sum","aptitudemax","CP","credits","COG","COO","INT","REF","SAV","SOM","WIL","5toskill","5fromskill","Durability","WT","morphtype","skill1","skill1value","skill2","skill2value","Gear","Traits","energyarmor","kineticarmor","traits","sizemod"
"Morph","Uplift","Neo-Dolphin","PO",143,"The uplifted versions of various dolphin species are very similar to baseline dolphins physiologically. Thanks to the oxygen reserve implant, neo-dolphins can stay underwater for longer (Cerean dolphins have gills installed, as the subcrustal sea has no breathable atmosphere above it). Common neo-dolphin germlines lack hands or other limbs, though cybernetic arms or even bioware enhancements are not uncommon. Neo-dolphin morphs are very rare, since there are few habitats that can support them, and they are almost never found apart from aquatic environments.","The uplifted versions of various dolphin species are very similar to baseline dolphins physiologically.",25,40,35000,0,5,5,0,0,5,0,1,0,30,6,4,"Swimming",40,,,"Basic Biomods, Basic Mesh Inserts, Cortical Stack, Echolocation, Enhanced Hearing, Oxygen Reserve",,0,0,,
"Morph","Uplift","Neo-Hominid (Gorilla)","PO",143,"To highlight the differences in neo-hominid species, apply the following stats for neo-gorillas. The neohominid entry in the Eclipse Phase core rulebook applies for neo-chimpanzees, neo-bonobos, and neo-orangutans.","Apply the following stats for neo-gorillas. The neohominid entry in the Eclipse Phase core rulebook applies for neo-chimpanzees, neo-bonobos, and neo-orangutans.",30,35,30000,0,0,5,0,0,10,0,1,0,40,8,4,,,,,"Basic Biomods, Basic Mesh Inserts, Cortical Stack, Prehensile Feet",,0,0,,
"Morph","Uplift","Neo-Orca","PO",143,"Though colloquially referred to as killer whales, orcas are actually members of the dolphin family. The average neo-orca length is 7 meters for males, 6 meters for females. Males also have larger and more triangular pectoral fins.","Though colloquially referred to as killer whales, orcas are actually members of the dolphin family. Average neo-orca length is 7 meters for males, 6 meters for females.",30,30,50000,0,5,5,0,0,10,0,1,0,40,8,4,"Swimming",40,"Unarmed Combat",20,"Basic Biomods, Basic Mesh Inserts, Cortical Stack, Echolocation, Enhanced Hearing, Oxygen Reserve",,0,0,,10
"Morph","Uplift","Neo-Pig","PO",143,"Uplifted pig morphs are bipedal and feature transgenic hands, feet, and vocal systems. They tend to be slightly shorter than the average transhuman but much stockier. Males grow tusks from their lower jaws.","Uplifted pig morphs are bipedal and feature transgenic hands, feet, and vocal systems. Slightly shorter than the average transhuman but much stockier. Males grow tusks.",25,35,20000,0,0,0,0,0,5,0,1,0,35,7,4,,,,,"Basic Biomods, Basic Mesh Inserts, Cortical Stack",,0,0,,
"Morph","Uplift","Neo-Porpoise","PO",143,"Neo-porpoises are smaller but very similar to neodolphins and similarly are much like their baseline relatives. They average 2.5 meters in length.","Neo-porpoises are smaller but very similar to neodolphins and similarly are much like their baseline relatives. They average 2.5 meters in length.",25,35,30000,0,0,5,0,0,5,0,1,0,25,5,4,"Swimming",50,,,"Basic Biomods, Basic Mesh Inserts, Cortical Stack, Echolocation, Enhanced Hearing, Oxygen Reserve",,0,0,,
"Morph","Uplift","Neo-Whale","PO",143,"Less than several hundred neo-whale morphs exist, and the majority remain occupied by their original egos. They are primarily found in Ceres and Atlantica. They are derived from humpback, blue, and sperm whale genetic stock. Humpbacks and blues are baleen whales and require large amounts of krill to survive. Sperm whales are toothed, feeding on fish and squid.","Derived from humpback, blue, and sperm whale genetic stock. Humpbacks and blues require large amounts of krill to survive. Sperm whales are toothed, feeding on fish.",30,75,75000,0,5,5,0,0,5,0,1,0,100,20,4,"Swimming",40,,,"Basic Biomods, Basic Mesh Inserts, Cortical Stack, Echolocation, Enhanced Hearing, Oxygen Reserve",,0,0,,30
"Morph","Pod","Shaper","PO",144,"Shapers are the ultimate disguise morph. Constructed as pods, the default shaper look is intentionally generic, based on the computer-generated composite average look of the solar system's residents. They lack the distinctive seam lines applied to most pod morph designs. The skinflex system allows the morph to quickly change its outward appearance. Additional modifications help the morph evade or fool sensor and biometric systems. Shapers are a favorite tool for spies and are excellent for infiltration or fooling surveillance. They are often remotely operated via puppet sock. Shapers are illegal in many habitats.","Shapers are the ultimate disguise morph. Default look is intentionally generic. Favorite tool for spies. Often remotely operated via puppet sock. Illegal in many habitats.",30,45,40000,0,0,5,0,5,0,0,1,0,30,6,3,,,,,"Basic Biomods, Basic Mesh Inserts, Chameleon Skin, Clean Metabolism, Cortical Stack, Cyberbrain, Emotional Dampers, Gait Masking, Mnemonic Augmentation, Nanotat ID Flux, Puppet Sock, Sex Switch, Skinflex",,0,0,,
"Morph","Synthetic Morph","Skulker","PO",144,"Skulkers are a stealth swarmanoid designed to infiltrate sensitive areas and avoid detection by sensors.","Skulkers are a stealth swarmanoid designed to infiltrate sensitive areas and avoid detection by sensors.",30,35,30000,0,0,0,0,0,0,0,0,0,30,6,2,,,,,"Access Jacks, Basic Mesh Inserts, Chameleon Skin, Cortical Stack, Cyberbrain, Mnemonic Augmentation, Radar Invisibility, Swarm Composition, Walker, Hopper, Rotor",,0,0,,
"Morph","Synthetic Morph","Takko","PO",144,"The first synthetic octopus design from the engineers at Feral Robot is a hardy shell custom-designed to make octopi uplifts feel more at home in a synthetic body with eight functioning appendages. Though it lacks ink sacs, the takko features vectored-thrust jets for microgravity propulsion.","The first synthetic octopus designed to make octopi uplifts feel more at home in a synthetic body. No ink sacs, but has vectored-thrust jets for microgravity propulsion.",30,60,45000,0,5,5,0,0,5,0,0,0,40,8,2,"Climbing",10,"Free Fall",10,"360-Degree Vision, Access Jacks, Basic Mesh Inserts, Chameleon Skin, Cortical Stack, Cyberbrain, Enhanced Vision, Extra Limbs, Grip Pads, Mnemonic Augmentation, Polarization Vision, Walker, Thrust Vector",,8,8,,
